{
  "record_id": "a3d59fb2977b02034173ad951a89385b34e0afd4c11acbe6d469b084238d506c",
  "slice_ref": {
    "repo": "forge-eval",
    "base_commit": "77ee",
    "head_commit": "88ff",
    "run_id": "run-2026-05-13-a"
  },
  "eval_parameter_revision": "eval_params_2026_05_rev7",
  "eval_signals": {
    "hazard_score": 0.83,
    "hazard_tier": "high",
    "merge_decision": "block",
    "reason_codes": [
      "hazard_blocking_threshold_exceeded"
    ],
    "selected_hidden": 1.0,
    "selected_method": "chao1",
    "chao2_available": false,
    "mean_psi_post": 0.22,
    "max_psi_post": 0.41,
    "null_coverage_ratio": 0.12,
    "k_eff": 4,
    "defect_count": 2,
    "reviewer_count": 3
  },
  "system_md_signals": {
    "declared_subsystems_updated": [
      "forge-eval"
    ],
    "declared_boundary_after": "Pack K landed; merge shipped clean"
  },
  "reconciliation_outcome": {
    "drift_found": true,
    "drift_types": [
      "false_block"
    ],
    "severity": "moderate",
    "implicated_parameters": [
      "hazard_blocking_threshold"
    ],
    "disposition": "confirmed_drift",
    "notes": "second over-block on forge-eval this cycle"
  },
  "record_version": "cal_record_v1",
  "recorded_at_revision": "cal_node_rev1"
}
