{
  "record_id": "4346048d0805add97786417ee1277c401f90499ee3ba38c218eeb9df17578fd6",
  "slice_ref": {
    "repo": "dataforge",
    "base_commit": "11de",
    "head_commit": "22ef",
    "run_id": "run-2026-05-06-a"
  },
  "eval_parameter_revision": "eval_params_2026_05_rev7",
  "eval_signals": {
    "hazard_score": 0.81,
    "hazard_tier": "high",
    "merge_decision": "block",
    "reason_codes": [
      "hazard_blocking_threshold_exceeded"
    ],
    "selected_hidden": 1.0,
    "selected_method": "chao1",
    "chao2_available": false,
    "mean_psi_post": 0.22,
    "max_psi_post": 0.41,
    "null_coverage_ratio": 0.12,
    "k_eff": 4,
    "defect_count": 2,
    "reviewer_count": 3
  },
  "system_md_signals": {
    "declared_subsystems_updated": [
      "forge-eval"
    ],
    "declared_boundary_after": "Pack K landed; merge shipped clean"
  },
  "reconciliation_outcome": {
    "drift_found": true,
    "drift_types": [
      "false_block"
    ],
    "severity": "moderate",
    "implicated_parameters": [
      "hazard_blocking_threshold"
    ],
    "disposition": "confirmed_drift",
    "notes": "block overturned in review; change was low-risk config"
  },
  "record_version": "cal_record_v1",
  "recorded_at_revision": "cal_node_rev1"
}
