{
  "record_id": "43c22e5a2489187b9526329ebec067331d1138e0cb6ae83800eb92922487ce26",
  "slice_ref": {
    "repo": "forge-math",
    "base_commit": "33aa",
    "head_commit": "44bb",
    "run_id": "run-2026-05-08-a"
  },
  "eval_parameter_revision": "eval_params_2026_05_rev7",
  "eval_signals": {
    "hazard_score": 0.86,
    "hazard_tier": "high",
    "merge_decision": "block",
    "reason_codes": [
      "hazard_blocking_threshold_exceeded"
    ],
    "selected_hidden": 1.0,
    "selected_method": "chao1",
    "chao2_available": false,
    "mean_psi_post": 0.22,
    "max_psi_post": 0.41,
    "null_coverage_ratio": 0.12,
    "k_eff": 4,
    "defect_count": 2,
    "reviewer_count": 3
  },
  "system_md_signals": {
    "declared_subsystems_updated": [
      "forge-eval"
    ],
    "declared_boundary_after": "Pack K landed; merge shipped clean"
  },
  "reconciliation_outcome": {
    "drift_found": true,
    "drift_types": [
      "false_block"
    ],
    "severity": "moderate",
    "implicated_parameters": [
      "hazard_blocking_threshold"
    ],
    "disposition": "confirmed_drift",
    "notes": "blocked a tested refactor; merged clean"
  },
  "record_version": "cal_record_v1",
  "recorded_at_revision": "cal_node_rev1"
}
